{
  "submission_id": "Submission-001",
  "judge_id": "B",
  "scores": {
    "problem_understanding": 8,
    "model_reasonableness": 18,
    "mathematical_rigor": 9,
    "data_handling": 6,
    "code_and_solving": 10,
    "model_validation": 12,
    "innovation": 6,
    "result_interpretation": 5,
    "paper_quality": 8,
    "reproducibility": 5
  },
  "fatal_flags": [],
  "notes": "Visible artifacts: 5 text/code files; metrics=present; empirical rows detected=69. Contest-fit review based on problem framing, assumptions, alternatives, validation, and evidence-linked interpretation in the submitted report."
}
