{
  "submission_id": "Submission-006",
  "judge_id": "A",
  "scores": {
    "problem_understanding": 9,
    "model_reasonableness": 12,
    "mathematical_rigor": 7,
    "data_handling": 3,
    "code_and_solving": 7,
    "model_validation": 3,
    "innovation": 5,
    "result_interpretation": 4,
    "paper_quality": 8,
    "reproducibility": 4
  },
  "fatal_flags": [],
  "notes": "Explicit risk formula, assumptions, falsification and limitations; location data absent and calibration/application explicitly pending."
}
