{
  "submission_id": "Submission-025",
  "judge_id": "A",
  "scores": {
    "problem_understanding": 9,
    "model_reasonableness": 16,
    "mathematical_rigor": 9,
    "data_handling": 7,
    "code_and_solving": 9,
    "model_validation": 10,
    "innovation": 6,
    "result_interpretation": 6,
    "paper_quality": 8,
    "reproducibility": 5
  },
  "fatal_flags": [],
  "notes": "Complete data audit, enhanced-vs-baseline CV, region effects, sensitivity and reproducibility are documented."
}
