{
  "submission_id": "Submission-016",
  "judge_id": "A",
  "scores": {
    "problem_understanding": 7,
    "model_reasonableness": 5,
    "mathematical_rigor": 3,
    "data_handling": 1,
    "code_and_solving": 5,
    "model_validation": 1,
    "innovation": 1,
    "result_interpretation": 2,
    "paper_quality": 5,
    "reproducibility": 3
  },
  "fatal_flags": [],
  "notes": "Report acknowledges absent SDG data and pending stages; only one figure and sparse quantitative evidence."
}
