{
  "submission_id": "Submission-008",
  "judge_id": "C",
  "scores": {
    "problem_understanding": 7,
    "model_reasonableness": 14,
    "mathematical_rigor": 7,
    "data_handling": 6,
    "code_and_solving": 8,
    "model_validation": 4,
    "innovation": 4,
    "result_interpretation": 5,
    "paper_quality": 7,
    "reproducibility": 3
  },
  "fatal_flags": [],
  "notes": "Visible files: 25 total, code=1, tests=0, figures=18; metrics=parsed; reproducibility=present. Missing or unusable evidence: test script."
}
