{
  "submission_id": "Submission-022",
  "judge_id": "A",
  "scores": {
    "problem_understanding": 9,
    "model_reasonableness": 14,
    "mathematical_rigor": 8,
    "data_handling": 2,
    "code_and_solving": 9,
    "model_validation": 8,
    "innovation": 5,
    "result_interpretation": 6,
    "paper_quality": 8,
    "reproducibility": 5
  },
  "fatal_flags": [],
  "notes": "Coupled stock-flow and 243-scenario robust optimization with Pareto/ranking metrics and reproducibility manifest."
}
