{
  "submission_id": "Submission-021",
  "judge_id": "A",
  "scores": {
    "problem_understanding": 9,
    "model_reasonableness": 13,
    "mathematical_rigor": 7,
    "data_handling": 1,
    "code_and_solving": 8,
    "model_validation": 6,
    "innovation": 5,
    "result_interpretation": 5,
    "paper_quality": 8,
    "reproducibility": 4
  },
  "fatal_flags": [],
  "notes": "Detailed ecological equations, falsification and sensitivity; no empirical rows and conclusions are appropriately limited."
}
