{
  "submission_id": "Submission-010",
  "judge_id": "A",
  "scores": {
    "problem_understanding": 9,
    "model_reasonableness": 13,
    "mathematical_rigor": 7,
    "data_handling": 3,
    "code_and_solving": 8,
    "model_validation": 5,
    "innovation": 5,
    "result_interpretation": 5,
    "paper_quality": 8,
    "reproducibility": 4
  },
  "fatal_flags": [],
  "notes": "Extensive report with equations, Monte Carlo/robustness and figures; data status and scenario nature are disclosed."
}
